{
  "prdId": "PRD-001",
  "productName": "Acme Notes",
  "version": "0.1.0",
  "status": "draft",
  "problemStatement": "Users keep losing track of meeting notes scattered across tools.",
  "objectives": [
    "Single home for personal notes across devices."
  ],
  "createdAt": "2026-01-01T00:00:00Z",
  "updatedAt": "2026-01-01T00:00:00Z"
}
